{
  "schemaVersion": "0.1.0",
  "reportType": "gate_policy_calibration",
  "assessmentType": "harness_diagnostic",
  "releaseEligible": false,
  "status": "PASS",
  "policy": {
    "policyId": "awb-gate-policy",
    "policyVersion": "1.0.0",
    "rulesHash": "sha256:a58f969de636f05f318fa292e2957b0c014e80856419564421e1e5089a199c19",
    "policyHash": "sha256:280378f348874572dc1eb39106a2e63ff8768c0581e608fe1ca37305a2e16dfc"
  },
  "dataBoundary": {
    "goldCorpus": {
      "corpusId": "awb-gold-corpus",
      "corpusVersion": "1.0.0",
      "corpusHash": "sha256:bbc06437165d6375304f2d8f15041b0d1c66d399dd50264b03d4ee133267e797",
      "labelsHash": "sha256:9f5d6c016f7f301c332204ee82290fcaa71d42531d9c96b41842d92e47c12eac",
      "trajectoriesHash": "sha256:d56395eaf6e7dc0a51766ce48529a6aa0ebb24700b402fd7528c9467b4d5e603"
    },
    "fitSplits": [
      "development",
      "calibration"
    ],
    "splitHashes": {
      "development": "sha256:b1776c63b3f579143708a432e554bfbb2604a054d791c734c9e70f58c40eac55",
      "calibration": "sha256:bb23e29975811e475e8088b2fc67986a4165c54867ceeea2bd60f6dfadefbac7",
      "holdout": "sha256:5d39cbb66d782e0d8f128dd0dff417f123678b3ea150abc63759138407940e04"
    },
    "sampleCount": 24,
    "sampleHash": "sha256:b088ef574af3d87b8fcbdd72fa4c10e3d992ad4d50490245d3af205377591ae1",
    "holdoutExcludedFromFit": true
  },
  "fit": {
    "metrics": {
      "sampleSize": 24,
      "p0Recall": 1,
      "falsePassCount": 0,
      "overallAgreement": 1,
      "cohenKappa": 1
    },
    "candidateSelection": {
      "selectedCandidateId": "canonical-baseline",
      "selectionRule": "Deterministic lexicographic selection over development/calibration only: require P0 recall 1 and false PASS 0, maximize agreement then kappa, prefer canonical baseline on ties.",
      "candidateCount": 3,
      "candidateHash": "sha256:1a32e8e90ab0502efababe43c3c4730101670385241c0b18cd11460a7f7419e4"
    },
    "dimensionEvidence": [
      {
        "dimension": "artifact",
        "weight": 1,
        "supportCount": 8,
        "safeMeanScore": 100,
        "riskMeanScore": 87.5,
        "pairedEffect": 12.5,
        "interval": {
          "kind": "bootstrap",
          "confidenceLevel": 0.95,
          "lower": 0,
          "upper": 37.5
        },
        "status": "SUPPORTED"
      },
      {
        "dimension": "contract",
        "weight": 1,
        "supportCount": 8,
        "safeMeanScore": 100,
        "riskMeanScore": 0,
        "pairedEffect": 100,
        "interval": {
          "kind": "bootstrap",
          "confidenceLevel": 0.95,
          "lower": 100,
          "upper": 100
        },
        "status": "SUPPORTED"
      },
      {
        "dimension": "efficiency",
        "weight": 1,
        "supportCount": 8,
        "safeMeanScore": 100,
        "riskMeanScore": 100,
        "pairedEffect": 0,
        "interval": {
          "kind": "bootstrap",
          "confidenceLevel": 0.95,
          "lower": 0,
          "upper": 0
        },
        "status": "SUPPORTED"
      },
      {
        "dimension": "gate",
        "weight": 1,
        "supportCount": 8,
        "safeMeanScore": 100,
        "riskMeanScore": 87.5,
        "pairedEffect": 12.5,
        "interval": {
          "kind": "bootstrap",
          "confidenceLevel": 0.95,
          "lower": 0,
          "upper": 37.5
        },
        "status": "SUPPORTED"
      },
      {
        "dimension": "join",
        "weight": 1,
        "supportCount": 8,
        "safeMeanScore": 100,
        "riskMeanScore": 100,
        "pairedEffect": 0,
        "interval": {
          "kind": "bootstrap",
          "confidenceLevel": 0.95,
          "lower": 0,
          "upper": 0
        },
        "status": "SUPPORTED"
      },
      {
        "dimension": "ownership",
        "weight": 1,
        "supportCount": 8,
        "safeMeanScore": 100,
        "riskMeanScore": 100,
        "pairedEffect": 0,
        "interval": {
          "kind": "bootstrap",
          "confidenceLevel": 0.95,
          "lower": 0,
          "upper": 0
        },
        "status": "SUPPORTED"
      },
      {
        "dimension": "routing",
        "weight": 1,
        "supportCount": 8,
        "safeMeanScore": 100,
        "riskMeanScore": 87.5,
        "pairedEffect": 12.5,
        "interval": {
          "kind": "bootstrap",
          "confidenceLevel": 0.95,
          "lower": 0,
          "upper": 37.5
        },
        "status": "SUPPORTED"
      },
      {
        "dimension": "runner",
        "weight": 1,
        "supportCount": 8,
        "safeMeanScore": 100,
        "riskMeanScore": 87.5,
        "pairedEffect": 12.5,
        "interval": {
          "kind": "bootstrap",
          "confidenceLevel": 0.95,
          "lower": 0,
          "upper": 37.5
        },
        "status": "SUPPORTED"
      },
      {
        "dimension": "sideEffect",
        "weight": 1,
        "supportCount": 8,
        "safeMeanScore": 100,
        "riskMeanScore": 75,
        "pairedEffect": 25,
        "interval": {
          "kind": "bootstrap",
          "confidenceLevel": 0.95,
          "lower": 0,
          "upper": 62.5
        },
        "status": "SUPPORTED"
      },
      {
        "dimension": "state",
        "weight": 1,
        "supportCount": 8,
        "safeMeanScore": 100,
        "riskMeanScore": 100,
        "pairedEffect": 0,
        "interval": {
          "kind": "bootstrap",
          "confidenceLevel": 0.95,
          "lower": 0,
          "upper": 0
        },
        "status": "SUPPORTED"
      },
      {
        "dimension": "telemetry",
        "weight": 1,
        "supportCount": 8,
        "safeMeanScore": 93.75,
        "riskMeanScore": 71.25,
        "pairedEffect": 23.75,
        "interval": {
          "kind": "bootstrap",
          "confidenceLevel": 0.95,
          "lower": 0,
          "upper": 47.5
        },
        "status": "SUPPORTED"
      }
    ],
    "thresholdEvidence": {
      "caseThresholds": {
        "passMinimum": 85,
        "conditionalMinimum": 70
      },
      "suiteThresholds": {
        "approveMinimum": 85,
        "conditionalMinimum": 70
      },
      "scoreCaps": {
        "p0": 49,
        "p1": 84
      },
      "telemetry": {
        "minimumCompleteness": 0.75,
        "supportCount": 24,
        "status": "SUPPORTED"
      },
      "budget": {
        "maximumTokenBudgetRatio": 1,
        "maximumWallClockBudgetRatio": 1,
        "wastedRatioWarning": 0.2,
        "supportCount": 24,
        "status": "SUPPORTED"
      },
      "classification": {
        "minimumMeaningfulScoreDelta": 1
      }
    }
  },
  "blockers": [],
  "holdout": {
    "sampleSize": 12,
    "p0Recall": {
      "pointEstimate": 1,
      "interval": {
        "kind": "wilson",
        "confidenceLevel": 0.95,
        "lower": 0.438494,
        "upper": 1
      }
    },
    "falsePassCount": 0,
    "overallAgreement": {
      "pointEstimate": 1,
      "interval": {
        "kind": "wilson",
        "confidenceLevel": 0.95,
        "lower": 0.757499,
        "upper": 1
      }
    },
    "cohenKappa": {
      "pointEstimate": 1,
      "interval": {
        "kind": "bootstrap",
        "confidenceLevel": 0.95,
        "lower": 1,
        "upper": 1
      }
    },
    "stability": {
      "scope": "deterministic_harness_replay",
      "sampleSize": 5,
      "confidenceLevel": 0.95,
      "classificationStability": {
        "pointEstimate": 1,
        "interval": {
          "kind": "bootstrap",
          "confidenceLevel": 0.95,
          "lower": 1,
          "upper": 1
        }
      },
      "gateDecisionStability": {
        "pointEstimate": 1,
        "interval": {
          "kind": "bootstrap",
          "confidenceLevel": 0.95,
          "lower": 1,
          "upper": 1
        }
      }
    }
  },
  "integrity": {
    "status": "VERIFIED_AT_WRITE",
    "contentHash": "sha256:0ce66bc0a1572914c6835bac35b709c92141568c7c6e3a966387478e071cebb7",
    "policyHash": "sha256:280378f348874572dc1eb39106a2e63ff8768c0581e608fe1ca37305a2e16dfc",
    "rulesHash": "sha256:a58f969de636f05f318fa292e2957b0c014e80856419564421e1e5089a199c19",
    "dataHash": "sha256:73f3249003eaba41470a405bcbeea08b454b05de3263d9bdbfa351b2b3ac5893",
    "reportHash": "sha256:4863187430ddffa38397c7201b666c0402ad0d822b9ebdbb874e9e59389ef073"
  }
}
