{
  "schemaVersion": "0.1.0",
  "reportType": "gate_policy_calibration",
  "assessmentType": "harness_diagnostic",
  "releaseEligible": false,
  "status": "PENDING_HOLDOUT",
  "policy": {
    "policyId": "awb-gate-policy",
    "policyVersion": "1.1.0",
    "rulesHash": "sha256:ca160f7cb842fa0b15c9a259f11289e7c1ccca37f72ab991dc110c594ecf0752",
    "policyHash": "sha256:650d570e19c64c6ddf7a760ae73d1698e5ec3c9518bd0c110e0e28ec86579da7"
  },
  "dataBoundary": {
    "goldCorpus": {
      "corpusId": "awb-gold-corpus",
      "corpusVersion": "1.0.0",
      "corpusHash": "sha256:79d6174aa1ecac51934fc153f2679e1ba94f2f1617789993091bea7b79d89b56",
      "labelsHash": "sha256:6e028efada195e5db1d8c161e835164805e55ed87c4ec274835a1662e4bd4902",
      "trajectoriesHash": "sha256:2f4fabe520bd3729ff54efcff99bd2348c7831b4c30a182afd010d69871ce7dc"
    },
    "fitSplits": [
      "development",
      "calibration"
    ],
    "splitHashes": {
      "development": "sha256:ebc2bbf4492c34ce3af5184d4bdd46f366f7016e428dd72c949b03ff9044f8cf",
      "calibration": "sha256:b29b5c9b703a0807095a7eacc689691d84dbc201e960e2871e3b5e416c217b5c"
    },
    "sampleCount": 36,
    "sampleHash": "sha256:8dafd97825f78d6e1a3e945fa4e87ef63877c0efe2e788cf7be4b9c38f01de5e",
    "holdoutExcludedFromFit": true
  },
  "fit": {
    "metrics": {
      "sampleSize": 36,
      "p0Recall": 1,
      "falsePassCount": 0,
      "overallAgreement": 1,
      "cohenKappa": 1
    },
    "candidateSelection": {
      "selectedCandidateId": "canonical-baseline",
      "selectionRule": "Deterministic lexicographic selection over development/calibration only: require P0 recall 1 and false PASS 0, maximize agreement then kappa, prefer canonical baseline on ties.",
      "candidateCount": 3,
      "candidateHash": "sha256:b98572fd0ca07a5a3a913aafb3ae408b9a9087ff1b07f98d409cc294d77a3424"
    },
    "dimensionEvidence": [
      {
        "dimension": "artifact",
        "weight": 1,
        "supportCount": 12,
        "safeMeanScore": 100,
        "riskMeanScore": 91.666667,
        "pairedEffect": 8.333333,
        "interval": {
          "kind": "bootstrap",
          "confidenceLevel": 0.95,
          "lower": 0,
          "upper": 25
        },
        "status": "SUPPORTED"
      },
      {
        "dimension": "contract",
        "weight": 1,
        "supportCount": 12,
        "safeMeanScore": 100,
        "riskMeanScore": 0,
        "pairedEffect": 100,
        "interval": {
          "kind": "bootstrap",
          "confidenceLevel": 0.95,
          "lower": 100,
          "upper": 100
        },
        "status": "SUPPORTED"
      },
      {
        "dimension": "efficiency",
        "weight": 1,
        "supportCount": 12,
        "safeMeanScore": 100,
        "riskMeanScore": 100,
        "pairedEffect": 0,
        "interval": {
          "kind": "bootstrap",
          "confidenceLevel": 0.95,
          "lower": 0,
          "upper": 0
        },
        "status": "SUPPORTED"
      },
      {
        "dimension": "gate",
        "weight": 1,
        "supportCount": 12,
        "safeMeanScore": 100,
        "riskMeanScore": 91.666667,
        "pairedEffect": 8.333333,
        "interval": {
          "kind": "bootstrap",
          "confidenceLevel": 0.95,
          "lower": 0,
          "upper": 25
        },
        "status": "SUPPORTED"
      },
      {
        "dimension": "join",
        "weight": 1,
        "supportCount": 12,
        "safeMeanScore": 100,
        "riskMeanScore": 100,
        "pairedEffect": 0,
        "interval": {
          "kind": "bootstrap",
          "confidenceLevel": 0.95,
          "lower": 0,
          "upper": 0
        },
        "status": "SUPPORTED"
      },
      {
        "dimension": "ownership",
        "weight": 1,
        "supportCount": 12,
        "safeMeanScore": 100,
        "riskMeanScore": 100,
        "pairedEffect": 0,
        "interval": {
          "kind": "bootstrap",
          "confidenceLevel": 0.95,
          "lower": 0,
          "upper": 0
        },
        "status": "SUPPORTED"
      },
      {
        "dimension": "routing",
        "weight": 1,
        "supportCount": 12,
        "safeMeanScore": 100,
        "riskMeanScore": 91.666667,
        "pairedEffect": 8.333333,
        "interval": {
          "kind": "bootstrap",
          "confidenceLevel": 0.95,
          "lower": 0,
          "upper": 25
        },
        "status": "SUPPORTED"
      },
      {
        "dimension": "runner",
        "weight": 1,
        "supportCount": 12,
        "safeMeanScore": 100,
        "riskMeanScore": 91.666667,
        "pairedEffect": 8.333333,
        "interval": {
          "kind": "bootstrap",
          "confidenceLevel": 0.95,
          "lower": 0,
          "upper": 25
        },
        "status": "SUPPORTED"
      },
      {
        "dimension": "sideEffect",
        "weight": 1,
        "supportCount": 12,
        "safeMeanScore": 100,
        "riskMeanScore": 83.333333,
        "pairedEffect": 16.666667,
        "interval": {
          "kind": "bootstrap",
          "confidenceLevel": 0.95,
          "lower": 0,
          "upper": 41.666667
        },
        "status": "SUPPORTED"
      },
      {
        "dimension": "state",
        "weight": 1,
        "supportCount": 12,
        "safeMeanScore": 100,
        "riskMeanScore": 100,
        "pairedEffect": 0,
        "interval": {
          "kind": "bootstrap",
          "confidenceLevel": 0.95,
          "lower": 0,
          "upper": 0
        },
        "status": "SUPPORTED"
      },
      {
        "dimension": "telemetry",
        "weight": 1,
        "supportCount": 12,
        "safeMeanScore": 94.166667,
        "riskMeanScore": 79.166667,
        "pairedEffect": 15.833333,
        "interval": {
          "kind": "bootstrap",
          "confidenceLevel": 0.95,
          "lower": 0,
          "upper": 39.583333
        },
        "status": "SUPPORTED"
      }
    ],
    "thresholdEvidence": {
      "caseThresholds": {
        "passMinimum": 85,
        "conditionalMinimum": 70
      },
      "suiteThresholds": {
        "approveMinimum": 85,
        "conditionalMinimum": 70
      },
      "scoreCaps": {
        "p0": 49,
        "p1": 84
      },
      "telemetry": {
        "minimumCompleteness": 0.75,
        "supportCount": 36,
        "status": "SUPPORTED"
      },
      "budget": {
        "maximumTokenBudgetRatio": 1,
        "maximumWallClockBudgetRatio": 1,
        "wastedRatioWarning": 0.2,
        "supportCount": 36,
        "status": "SUPPORTED"
      },
      "classification": {
        "minimumMeaningfulScoreDelta": 1
      }
    }
  },
  "blockers": [],
  "integrity": {
    "status": "VERIFIED_AT_WRITE",
    "contentHash": "sha256:ae9eef4b5a8309c21caa2d5076b2950a3c47ca2cbcc711e7dba927447e32bdc1",
    "policyHash": "sha256:650d570e19c64c6ddf7a760ae73d1698e5ec3c9518bd0c110e0e28ec86579da7",
    "rulesHash": "sha256:ca160f7cb842fa0b15c9a259f11289e7c1ccca37f72ab991dc110c594ecf0752",
    "dataHash": "sha256:2c3741b6b7b780fccf44bdd643ad111b310994736dcf61e4a377671a2b269299",
    "reportHash": "sha256:b25d4d64354fe5c295a5f76cbe74d9aec1d944635839bbe094745b65427ff5b2"
  }
}
